[
  {"id":"todo-verify-mayor","name":"TODO: verify - current Mayor","role":"Mayor","branch":"executive","status":"unverified","term":null,"officeId":null,"provenance":{"source_url":"https://limaybataan.ph/","source_name":"Official Municipality of Limay website (currently under construction)","retrieved_at":"2026-09-21","verified":false,"verification_note":"Role placeholder only; current officeholder not verified."}},
  {"id":"todo-verify-vice-mayor","name":"TODO: verify - current Vice Mayor","role":"Vice Mayor","branch":"executive","status":"unverified","term":null,"officeId":null,"provenance":{"source_url":"https://limaybataan.ph/","source_name":"Official Municipality of Limay website (currently under construction)","retrieved_at":"2026-09-21","verified":false,"verification_note":"Role placeholder only; current officeholder not verified."}},
  {"id":"todo-verify-sangguniang-bayan","name":"TODO: verify - Sanggunian members","role":"Sangguniang Bayan member","branch":"legislative","status":"unverified","term":null,"officeId":null,"provenance":{"source_url":"https://limaybataan.ph/","source_name":"Official Municipality of Limay website (currently under construction)","retrieved_at":"2026-09-21","verified":false,"verification_note":"Role placeholder only; current roster not verified."}},
  {"id":"todo-verify-abc-president","name":"TODO: verify - ABC Federation President","role":"ABC Federation President (ex-officio)","branch":"ex-officio","status":"unverified","term":null,"officeId":null,"provenance":{"source_url":"https://limaybataan.ph/","source_name":"Official Municipality of Limay website (currently under construction)","retrieved_at":"2026-09-21","verified":false,"verification_note":"Role placeholder only; current officeholder not verified."}},
  {"id":"todo-verify-sk-president","name":"TODO: verify - SK Federation President","role":"SK Federation President (ex-officio)","branch":"ex-officio","status":"unverified","term":null,"officeId":null,"provenance":{"source_url":"https://limaybataan.ph/","source_name":"Official Municipality of Limay website (currently under construction)","retrieved_at":"2026-09-21","verified":false,"verification_note":"Role placeholder only; current officeholder not verified."}}
]
